{
  "$schema": "http://json-schema.org/draft-07/schema#",
  "title": "G9.3 M92 gpu_skinning_lod_update evidence",
  "description": "evidence/g9_m92_gpu_skinning_lod_update_<UTC>.json。G9.3 P1 硬门 g9.p1.m92.gpu_skinning_lod_update:GPU 蒙皮 kernel 输出与 host Kerbl 参照逐顶点一致(定点化输入域容差 0;浮点域 measured 登记非判据);bound_inflation 应用后的保守包围体含全部蒙皮后顶点(对抗姿态序列 100% 包含,法向锥覆盖真实法向);距离分级更新率档位表为规范闭集(全速/1/2/1/3/1/4),档位切换对同输入确定(双运行逐位一致);蒙皮簇 AS 更新经 AsStats 计数非空可机核;静态帧零 AS 构建。host 段 skinning::tests 15 单测 + geom-build dag 桥单测;device 腿必需(g9_m92_skinning_device 手编 SPV kernel 真跑 + RED 四臂);RURIX_REQUIRE_REAL=1 下 SKIP 不充绿。",
  "type": "object",
  "additionalProperties": false,
  "required": [
    "schema_version",
    "subject",
    "symbolic_gate_key",
    "matrix_row",
    "milestone",
    "assertion_id",
    "status",
    "wave",
    "numeric_step",
    "source_ref",
    "base_commit",
    "host_section_pass",
    "device_section_state",
    "checks",
    "commands",
    "evidence_level",
    "run_url",
    "timestamp",
    "environment",
    "notes"
  ],
  "properties": {
    "schema_version": { "type": "integer", "const": 1 },
    "subject": { "type": "string", "const": "g9_m92_gpu_skinning_lod_update" },
    "symbolic_gate_key": { "type": "string", "const": "g9.p1.m92.gpu_skinning_lod_update" },
    "matrix_row": { "type": "string", "const": "M92" },
    "milestone": { "type": "string", "const": "M92" },
    "assertion_id": { "type": "string", "const": "g9.p1.m92.gpu_skinning_lod_update" },
    "status": { "type": "string", "enum": ["pass", "fail"] },
    "wave": { "type": "string", "const": "G9.3" },
    "numeric_step": { "type": "integer", "const": 142 },
    "source_ref": {
      "type": "string",
      "const": "spec/virtual_geometry.md RXS-0353;G9_ACCEPTANCE_MAP §3 M92;G9_CONTRACT §8.1 裁决①"
    },
    "base_commit": { "type": "string" },
    "host_section_pass": { "type": "boolean" },
    "device_section_state": {
      "type": "string",
      "enum": [
        "executed",
        "skipped_dev_env",
        "pass",
        "fail",
        "not_applicable",
        "dev_env_degrade"
      ]
    },
    "checks": {
      "type": "object",
      "additionalProperties": false,
      "required": [
        "host_skinning_tests_anchored",
        "host_geom_build_dag_bridge_anchored",
        "device_pass",
        "device_vertex_cone_bitexact",
        "device_containment_invariants",
        "device_tier_closed_set_deterministic",
        "device_static_zero_build_as_counted",
        "device_red_arms_ok",
        "device_validation_zero"
      ],
      "properties": {
        "host_skinning_tests_anchored": { "type": "boolean" },
        "host_geom_build_dag_bridge_anchored": { "type": "boolean" },
        "device_pass": { "type": "boolean" },
        "device_vertex_cone_bitexact": { "type": "boolean" },
        "device_containment_invariants": { "type": "boolean" },
        "device_tier_closed_set_deterministic": { "type": "boolean" },
        "device_static_zero_build_as_counted": { "type": "boolean" },
        "device_red_arms_ok": { "type": "boolean" },
        "device_validation_zero": { "type": "boolean" }
      }
    },
    "commands": {
      "type": "array",
      "items": {
        "type": "object",
        "required": ["seq", "command", "exit_code"],
        "properties": {
          "seq": { "type": "integer" },
          "command": { "type": "string" },
          "exit_code": { "type": "integer" }
        }
      }
    },
    "evidence_level": { "type": "string", "const": "measured_local" },
    "run_url": { "type": "string" },
    "timestamp": { "type": "string" },
    "environment": {
      "type": "object",
      "additionalProperties": false,
      "required": ["os", "python_version", "cargo_version", "rustc_version"],
      "properties": {
        "os": { "type": "string" },
        "python_version": { "type": "string" },
        "cargo_version": { "type": "string" },
        "rustc_version": { "type": "string" }
      }
    },
    "notes": { "type": "string" }
  }
}
