{
  "schema_version": 1,
  "subject": "g9_m92_gpu_skinning_lod_update",
  "symbolic_gate_key": "g9.p1.m92.gpu_skinning_lod_update",
  "matrix_row": "M92",
  "milestone": "M92",
  "assertion_id": "g9.p1.m92.gpu_skinning_lod_update",
  "status": "pass",
  "wave": "G9.3",
  "numeric_step": 142,
  "source_ref": "spec/virtual_geometry.md RXS-0353;G9_ACCEPTANCE_MAP §3 M92;G9_CONTRACT §8.1 裁决①",
  "base_commit": "ec27492add88c3f36f7412b7ec1ff670a5c2d1ed",
  "host_section_pass": true,
  "device_section_state": "executed",
  "checks": {
    "host_skinning_tests_anchored": true,
    "host_geom_build_dag_bridge_anchored": true,
    "device_pass": true,
    "device_vertex_cone_bitexact": true,
    "device_containment_invariants": true,
    "device_tier_closed_set_deterministic": true,
    "device_static_zero_build_as_counted": true,
    "device_red_arms_ok": true,
    "device_validation_zero": true
  },
  "commands": [
    {
      "seq": 1,
      "command": "cargo test -p rurix-render --lib skinning",
      "exit_code": 0
    },
    {
      "seq": 2,
      "command": "cargo test -p rurix-geom-build --lib dag",
      "exit_code": 0
    },
    {
      "seq": 3,
      "command": "cargo build -p rurix-render --features vulkan --bin g9_m92_skinning_device",
      "exit_code": 0
    },
    {
      "seq": 4,
      "command": "g9_m92_skinning_device (RURIX_REQUIRE_REAL=1 + RURIX_VK_VALIDATION=1)",
      "exit_code": 0
    }
  ],
  "evidence_level": "measured_local",
  "run_url": "",
  "timestamp": "20260815T021230Z",
  "environment": {
    "os": "Windows-11-10.0.28120-SP0",
    "python_version": "3.12.1",
    "cargo_version": "cargo 1.93.1 (083ac5135 2025-12-15)",
    "rustc_version": "rustc 1.93.1 (01f6ddf75 2026-02-11)"
  },
  "notes": ""
}
